formations,experiences,competences,Qualités,langues,permis,metier
"[""Formation PIC POEC Développeurs en Cybersécurité\n\n| Bac+3, Bac+4 ou équivalents Cette Formation contient une pièce jointe 2024 Etat de l'art de la cybersécurité et notions de gouvernance, Protocoles HTTP et architectures applicatives, réseau IP, fondamentaux HTML5 CSS3 et JAVASCRIPT, PHP, Python, démarche agile, techniques hacking et contre-mesures, sécurité des applications web, EBIOS, ISO 27005 et 27001li, sécurité du DevOps pour le SI,\nsécurité des bases de données (hachage, cryptage, code du backend, droits ) Pièces jointes .pdf .pdf Voir plus Voir moins"", ""Formation Titre Professionel de technicien supérieur SIG\n\n| Bac+2 ou équivalents 2019 Diplôme ou qualification obtenu(e). formation de 805h, 6 mois, en vue de devenir géomaticien - Domaine de formation : Cartographie Compétences Collecter des informations géographiques (Intermédiaire) Développer et administrer une base de données géographiques (catalogues de données, de métadonnées) (Intermédiaire) Gérer une base de données numériques (Intermédiaire) Gestion de projet (Intermédiaire) Restituer des informations géographiques par une cartographie à thèmes (Intermédiaire) Restituer et mettre en forme les données géographiques pour l'édition cartographique (Intermédiaire) Sélectionner une gamme de données géoréférencées ciblées (Intermédiaire) Structurer des informations géographiques (Intermédiaire) Système d'Information Géographique (SIG) (Intermédiaire) Techniques de numérisation (Avancé) Utilisation de logiciels de cartographie (Avancé) Utiliser les outils numériques (Avancé) Voir plus Voir moins"", 'Formation SECRETARIAT JURIDIQUE\n\n| Bac ou équivalent 2012 FORMATION CONTINUE - Domaine de formation : Droit Compétences Utiliser les outils numériques (Avancé) Voir plus Voir moins', 'Formation DAEU OPTION B - Equivalent BAC S\n\n| Bac ou équivalent 1999 Diplôme ou qualification obtenu(e). CNAM - Domaine de formation : Services Commerces Proximité Voir plus Voir moins', 'Formation ADMINISTRATION COMMERCIALE ET COMPTABLE\n\n| CAP, BEP et équivalents 1993 Diplôme ou qualification obtenu(e). Centre de formation ADFE - Domaine de formation : Comptabilité Compétences Utiliser les outils numériques (Avancé) Voir plus Voir moins', 'Formation EMPLOYEE DES SERVICES ADMINISTRATIFS ET COMMERCIAUX\n\n| CAP, BEP et équivalents 1993 Diplôme ou qualification obtenu(e). Centre de formation ADFE - Domaine de formation : Secrétariat Assistanat Compétences Utiliser les outils numériques (Avancé) Voir plus Voir moins', 'Formation NIV.BTS GESTION ET PRODUCTION DE LA NATURE + DAEU\n\n| Bac+2 ou équivalents - Domaine de formation : Environnement Aménagement Compétences Hydrographie (Débutant) Gestion de projet (Intermédiaire) Techniques de numérisation (Avancé) Utiliser les outils numériques (Avancé) Voir plus Voir moins']","[""Expérience Technicienne SIG\n\n| Agence de l'Eau Adour Garonne (Toulouse) Cette Expérience contient une pièce jointe de juin 2023 à déc. 2023 (7 mois) Etat des lieux des points de prélèvements agricoles souterrains sur l'ensemble du bassin Adour Garonne (26 départements)\nRecherche, récupération, requêtes de jointures avec l'existant, modifications des données attributaires et géographiques des points.\nQGIS, POSTGRESQL, DBEAVER Pièces jointes .pdf .pdf Voir plus Voir moins"", ""Expérience Technicienne SIG\n\n| Nanogis (Télétravail Toulouse) de mai 2021 à mars 2023 (1 an et 11 mois) Création et gestion des base de données postgreSQL et  PostGis . Droits,vues, fonctions et triggers, récupération et remplissage avec FME,  Créations projet QGIS intégrés dans la base avec formulaires. \nAssistance et formation aux utilisateurs sur numérisation .\nTraitements de données cours d'eau, plan d'eau, hydroelectricité.\nCréation de tables d'audit et de suivi d'autres tables dans postgreSQL Voir plus Voir moins"", 'Expérience Technicienne SIG\n\n| SPIE CITYNETWORKS (Toulouse) de juil. 2020 à févr. 2021 (8 mois) Reprise de projet D1 et D2 pour l’installation de la fibre optique au format GRACE THD\navec PostgreSQL, cartographie et installation du réseau sur QGIS, récupération des\ndonnées terrain au format CSV avec FIBEES, transformation en shapefile. Script de\ncontrôle et de mise à jour de la base en langage SQL. Voir plus Voir moins', 'Expérience Technicienne SIG\n\n| PARERA (Toulouse) de déc. 2019 à mai 2020 (6 mois) Etude de projet APD pour la mise en place en D2 de la fibre optique selon les règles\nd’ingénierie. Mise à jour base de données et création des plans d’installation du\nmatériel, Création des projets, équipements, câbles, PF et fibrage.\nCalcul de charge de poteaux, Préparation doc travaux et livrables.\nUtilisation de OPTIMUM, SISSI, IPON, CAPFT, Land2Fibre, QGIS et Géofibre Voir plus Voir moins', ""Expérience Stagiaire SIG\n\n| Institution de l'Adour - Observatoire de l'eau (pau) de mai 2019 à juil. 2019 (3 mois) Mise en place et création d'une base de données sur les captages et périmètres d'eau potable sur le bassin de l'Adour \nRecherche et intégration des données, MCD, requêtes et langage SQL sur Postgres/Postgis\nConnexion de la base dans QGIS pour représentations cartographiques, géotraitements, sélections et sorties statistiques sur tableaux\nMétadonnées Compétences Hydrographie (Débutant) Collecter des informations géographiques (Intermédiaire) Développer et administrer une base de données géographiques (catalogues de données, de métadonnées) (Intermédiaire) Gérer une base de données numériques (Intermédiaire) Gestion de projet (Intermédiaire) Restituer des informations géographiques par une cartographie à thèmes (Intermédiaire) Restituer et mettre en forme les données géographiques pour l'édition cartographique (Intermédiaire) Sélectionner une gamme de données géoréférencées ciblées (Intermédiaire) Structurer des informations géographiques (Intermédiaire) Système d'Information Géographique (SIG) (Intermédiaire) Techniques de numérisation (Avancé) Utilisation de logiciels de cartographie (Avancé) Utiliser les outils numériques (Avancé) Voir plus Voir moins"", ""Expérience Stagiaire SIG\n\n| SYDEC (MONT DE MARSAN) janv. 2019 Découverte du métier de géomaticien\nRéalisation d'un projet de mise à jour de cartes sur QGIS, avec analyse et comparaison de données de défense incendie issues de différentes sources. Utilisation de géoportail, Portail web SIRAP, Street View.\nPropositions de solutions opérationnelles aux problèmes rencontrés\nRéalisation d'une notice sur le projet. Compétences Traiter les demandes de support technique (Débutant) Identifier et interpréter les données et caractéristiques géographiques et analyser les résultats (Intermédiaire) Sélectionner, traiter et réaliser l'analyse spatiale de données géographiques (Intermédiaire) Système d'Information Géographique (SIG) (Intermédiaire) Techniques de numérisation (Avancé) Utilisation de logiciels de cartographie (Avancé) Utiliser les outils numériques (Avancé) Voir plus Voir moins"", 'Expérience aide comptable\n\n| METALECO - ADECCO INTERIM de mars 2018 à avr. 2018 (2 mois) Établissement et enregistrement des chèques et LCR fournisseurs sur 5 sociétés Rapprochement et écritures de banques Lettrage comptes clients Utilisation de Sage et Proginov Compétences Utiliser les outils numériques (Avancé) Voir plus Voir moins', ""Expérience adjoint administratif et assistante comptable\n\n| SYDEC Syndicat de l'eau des Landes Mont de Marsan de avr. 2017 à janv. 2018 (10 mois) Gestion des mails, courriers déclaration et suivi des sinistres de la flottes automobile, saisie des bons de commande et validation des factures, plans de prévention sur les châteaux d'eau, validation factures, saisie comptable Marchés publics Compétences Utiliser les outils numériques (Avancé) Voir plus Voir moins"", ""Expérience Adjoint administratif et assistante comptable\n\n| SYDEC Syndicat de l'eau des Landes de avr. 2017 à janv. 2018 (10 mois) Suivi et gestion des mails, courrier s, déclaration et suivi des sinistres de la flotte automobile,  saisie des bons de commande  enregistrement et suivi des plans de prévention sur les châteaux d'eau, validation factures et saisie comptable Compétences Utiliser les outils numériques (Avancé) Voir plus Voir moins"", 'Expérience secrétaire comptable - assistante administrative (missions interim)\n\n| menway ( SLS TP et CFA ) de juin 2016 à sept. 2016 (4 mois) accueil téléphonique, secrétariat, devis, facturation, saisie comptable enregistrement de dossiers apprentis Compétences Utiliser les outils numériques (Avancé) Voir plus Voir moins', ""Expérience secrétaire comptable plusieurs missions intérims\n\n| SLS TP Hontanx - CFA de Mont de Marsan de juin 2016 à sept. 2016 (4 mois) Accueil, téléphone, devis, facturation, saisie comptable sur isagri , règlements Enregistrement de dossiers d'apprentis Compétences Utiliser les outils numériques (Avancé) Voir plus Voir moins"", ""Expérience Chaudronnière aéronautique\n\n| Potez Aéronautique de juil. 2013 à déc. 2015 (2 ans et 6 mois) Réalisation de pièces de structures d'avions et d'hélicoptères par : formage, pliage, emboutissage, allongement, rétreinte, planage, cintrage, roulage... Utilisation de machine manuelle et électrique pour le découpage, le formage et  l'ajustage. Voir plus Voir moins"", 'Expérience Opératrice de saisie\n\n| IGESA Institution de Gestion Sociale des Armées de juil. 2012 à sept. 2012 (3 mois) Saisie des factures et traitements des LCR Compétences Utiliser les outils numériques (Avancé) Voir plus Voir moins', 'Expérience Stagiaire en secrétariat juridique\n\n| TASS - Tribunal des Affaires de Sécurité Sociale de févr. 2012 à mars 2012 (2 mois) Compétences Utiliser les outils numériques (Avancé) Voir plus Voir moins', ""Expérience Secrétaire comptable\n\n| SARL ANALYSE CONSEIL AUDIT - Cabinet d'expertise comptable de juil. 2010 à oct. 2011 (1 an et 4 mois) Accueil physique et téléphonique, secrétariat, saisie comptable, suivi commandes, devis, facturation, gestion chèques déjeuners, déclaration de TVA Compétences Utiliser les outils numériques (Avancé) Voir plus Voir moins"", ""Expérience secrétaire comptable\n\n| CRAPSE Association d'aide à l'informatique de oct. 2009 à nov. 2009 (2 mois) Accueil téléphonique et physique, secrétariat, saisie comptable Compétences Utiliser les outils numériques (Avancé) Voir plus Voir moins"", 'Expérience Technicienne de programmation\n\n| MEDIANE SAS - Editeur de logiciel de santé de juin 2008 à nov. 2008 (6 mois) Assistance et formation à distance sur les logiciels installés (hôpitaux, maison de retraite) Compétences Utiliser les outils numériques (Avancé) Voir plus Voir moins', 'Expérience Aide comptable\n\n| ATA - Automatisme et Techniques Avancées de sept. 2007 à oct. 2007 (2 mois) saisie des factures et de règlements, traitements des LCR Compétences Utiliser les outils numériques (Avancé) Voir plus Voir moins']","['Développer et administrer une base de données géographiques (catalogues de données, de métadonnées)', ""Formaliser des données cartographiques et les diffuser sur des réseaux d'information"", 'Gérer une base de données numériques', 'Identifier et interpréter les données et caractéristiques géographiques et analyser les résultats', 'Restituer des informations géographiques par une cartographie à thèmes', ""Sélectionner, traiter et réaliser l'analyse spatiale de données géographiques"", 'Sélectionner une gamme de données géoréférencées ciblées', 'Structurer des informations géographiques', 'Hydrographie', 'Langages de programmation informatique', ""Système d'Information Géographique (SIG)"", 'Utilisation de logiciels de cartographie', 'Classer des documents', 'Collecter des informations géographiques', ""Restituer et mettre en forme les données géographiques pour l'édition cartographique"", 'Utiliser les outils numériques', 'Données géoréférencées', 'Gestion de projet', ""Méthode de classement et d'archivage"", 'Recueillir et analyser les besoins client', 'Traiter les demandes de support technique', 'Techniques de digitalisation', 'Techniques de numérisation', ""Prendre une décision et l'expliquer""]","['Faire preuve de curiosité', 'Faire preuve de persévérance', 'Prendre des initiatives et être force de proposition', ""S'adapter aux changements"", 'Travailler en équipe']",['Anglais'],['B - Véhicule léger'],Administrateur de base de données
"[""Formation Ecole d'ingénieur Polytechnique de l'Université de Paris-Saclay\n\n| Bac+5 et plus ou équivalents 2024 Diplôme ou qualification obtenu(e). - Domaine de formation : Logiciel Internet Information Services Voir plus Voir moins"", ""Formation Ecole d'ingénieur Polytechnique de l'Université de Sorbonne\n\n| Bac+2 ou équivalents 2021 Diplôme ou qualification obtenu(e). - Domaine de formation : Logiciel Internet Information Services Voir plus Voir moins""]","['Expérience Stage DevOps Engineer\n\n| Sopra Banking Software (Paris) de mars 2024 à sept. 2024 (7 mois) • Automatisation des processus de build et de déploiement avec Jenkins et GitLab CI. Outils : Jenkins, GitLab CI\n• Introduction de Docker et orchestration des microservices avec Kubernetes. Outils : Docker, Kubernetes \n• Migration des serveurs RedHat vers des versions récentes pour améliorer la sécurité et la performance. Outils : RedHat, Linux, Shell Bash Voir plus Voir moins', ""Expérience Stage Full-Stack Developer\n\n| OUIDOU Consulting (Paris) de mai 2023 à août 2023 (4 mois) • Développement de composants React en TypeScript basés sur un modèle Figma pour une interface réactive. Outils: React, TypeScript, Figma\n• Conception d'API REST en Java avec les design patterns DAO, DTO, Mapper, Service et Entity pour une architecture propre. Outils : Java, Spring\n• Connexion à la base de données Oracle avec OJDBC pour gérer les transactions et connexions. Outils : Oracle, OJDBC Voir plus Voir moins""]","['Architecture réseau', 'Bitbucket', 'C', 'Cryptologie', 'CSS', 'Docker', 'Framework Spring', 'Gestion de bases de données NoSQL', 'Gestion de versions de logiciels de jeux', 'Gestion du Back Office', 'GitHub', 'GitLab', 'Graphisme', 'HTML', 'Java', 'Kubernetes', 'Langage C++', 'Microsoft Excel', 'Microsoft PowerPoint', 'Microsoft Word', 'Oracle', 'Photoshop', 'Programmation en JavaScript', 'Programmation en Python', 'React.js', 'Script Shell', ""Système d'exploitation Linux"", ""Système d'exploitation Windows"", 'Utilisation de frameworks de test', 'Concevoir des réseaux informatiques', 'Gérer la sécurité informatique', 'Règles de sécurité', 'Ansible', 'ArgoCD (débutant)', 'AWS', 'CentOS', 'CircleCI (débutant)', 'Conteneurs et Orchestration', 'Jenkins', 'Kali', 'PLSQL', 'PostgreSQL', 'RedHat', 'Terraform (débutant)', 'Typescript (modéré)']","[""Faire preuve d'autonomie"", 'Faire preuve de leadership', 'Gérer son stress', 'Organiser son travail selon les priorités et les objectifs']","['Anglais- TOEIC ~ 800', 'Chinois (Mandarin)- HSK5', 'Français', 'Espagnol']",[],Administrateur de base de données
"[""Formation Technicien Supérieur en Technologies Numériques\n\n| Bac+2 ou équivalents 2024 - Domaine de formation : Informatique Et Systèmes D'information Voir plus Voir moins"", 'Formation Technicien Systeme, Reseaux Et Securit 2024 Diplôme ou qualification obtenu(e).', 'Formation Licence Langues, Litteratures Et Civilisations Etrangeres Et Regionales Anglais \n\n| Bac+3, Bac+4 ou équivalents 2021', 'Formation Licence Physique-chimie - Universite Sorbonne Jussieu, Paris 5\n\n| Bac+3, Bac+4 ou équivalents 2020']","[""Expérience Technicien Système et Réseaux\n\n| Maintenance du parc informatique (Bignon) de févr. 2022 à févr. 2024 (2 ans) Cabinet Lebray, Paris , gestion d'appareils informatique, déploiement et préparation de postes utilisateurs, brassage réseau, configuration de serveurs Voir plus Voir moins"", 'Expérience Recruteur de donateurs\n\n| Association Care France (Paris) de juin 2017 à août 2017 (3 mois) Mission de type ""street"" : requêtes de donations auprès des passants - Recueillir des fonds auprès de 2 à 3 donneurs par jour, sur un périmètre donné Voir plus Voir moins']","['Adobe Première Pro', 'Application mobile sous Android', 'Fireworks', 'Google Analytics', 'Informatique', 'Maîtrise du pack Office (Word, Excel, Outlook, PowerPoint)', 'Messagerie électronique ThunderBird', 'Microsoft SQL Server', 'Microsoft Visio', 'Photoshop', 'SharePoint', ""Système d'exploitation Linux"", ""Système d'exploitation Windows"", ""Technologie de l'internet"", 'Zones DNS (système des noms de domaines)', 'Maintenance préventive/curative de deuxième niveau', 'Protocoles de communication (TCP/IP)', 'Protocoles et normes télécoms TFTP', 'Gestion de crise', 'Techniques de gestion de conflits', 'Techniques de tirage de câble', 'Installer un système de téléphonie sur IP', 'Réaliser des opérations de montage, démontage de pièces', 'Réaliser un diagnostic technique', 'Réparer du matériel de téléphonie mobile, jeux vidéos, tablettes', 'Utilisation de machine chrome jet', ""Utilisation de machines ou équipements d'impression à feuilles"", 'Convaincre, négocier', ""Gérer l'inventaire des matériaux et fournitures"", 'Effectuer une livraison', 'Avast', 'configuration routeurs', 'Configuration Switch', 'création et gestion d’annuaire AD', 'Debian', 'fax', 'Firefox', 'Gmail', 'Internet explorer', 'Kaspersky', ""Matériel : PC fixe et Laptop Installation d'OS"", 'Maxthon', 'Microsoft Edge', 'Norton', 'OneDrive', 'Outil de Sauvegarde', 'Relation clients : informer', 'Réseau : Wi-Fi', 'Sécurité : McAfee', 'Type d’intervention : support clients', 'Windows', 'Windows 10', 'Windows 11', 'Windows 8(notions)', 'Windows Defender', 'Windows server 2008', 'Zimbra']",[],"['Anglais', 'Français', 'Espagnol']",[],Administrateur de base de données
"[""Formation Expert en Informatique et Systèmes d'Information\n\n| Bac+5 et plus ou équivalents 2023 Diplôme ou qualification obtenu(e). - Domaine de formation : Informatique Et Systèmes D'information Compétences PHP (Intermédiaire) React.js (Intermédiaire) Analyser, exploiter, structurer des données (Avancé) Coder (Avancé) Développer une application en lien avec une base de données (Avancé) Gestion de bases de données NoSQL (Avancé) Programmation en Python (Avancé) Voir plus Voir moins"", ""Formation Master Big Data, Dev & IA\n\n| Bac+5 et plus ou équivalents 2023 Diplôme ou qualification obtenu(e). - Domaine de formation : Informatique Et Systèmes D'information Compétences PHP (Intermédiaire) React.js (Intermédiaire) Analyser, exploiter, structurer des données (Avancé) Coder (Avancé) Développer une application en lien avec une base de données (Avancé) Gestion de bases de données NoSQL (Avancé) Programmation en Python (Avancé) Voir plus Voir moins"", ""Formation Licence Développement Web et Logiciel\n\n| Bac+3, Bac+4 ou équivalents 2020 Diplôme ou qualification obtenu(e). - Domaine de formation : Informatique Et Systèmes D'information Compétences Planifier et suivre les échéances de projet (Débutant) CSS (Intermédiaire) Java (Intermédiaire) PHP (Intermédiaire) React.js (Intermédiaire) Coder (Avancé) Développer une application en lien avec une base de données (Avancé) Gestion de bases de données NoSQL (Avancé) HTML (Avancé) Programmation en Python (Avancé) Voir plus Voir moins"", ""Formation Licence Science, Technologie, Santé\n\n| Bac+3, Bac+4 ou équivalents 2020 Diplôme ou qualification obtenu(e). - Domaine de formation : Informatique Et Systèmes D'information Compétences Planifier et suivre les échéances de projet (Débutant) CSS (Intermédiaire) Java (Intermédiaire) PHP (Intermédiaire) React.js (Intermédiaire) Coder (Avancé) Développer une application en lien avec une base de données (Avancé) Gestion de bases de données NoSQL (Avancé) HTML (Avancé) Programmation en Python (Avancé) Voir plus Voir moins"", ""Formation BTS Services Informatiques aux Organisations\n\n| Bac+2 ou équivalents 2019 Diplôme ou qualification obtenu(e). - Domaine de formation : Informatique Et Systèmes D'information Compétences CSS (Intermédiaire) Java (Intermédiaire) PHP (Intermédiaire) XML (Intermédiaire) Coder (Avancé) Développer une application en lien avec une base de données (Avancé) Gestion de bases de données NoSQL (Avancé) HTML (Avancé) Programmation en Python (Avancé) Voir plus Voir moins"", ""Formation BTS Services Informatiques aux Organisations option SLAM\n\n| Bac+2 ou équivalents 2019 Diplôme ou qualification obtenu(e). - Domaine de formation : Informatique Et Systèmes D'information Compétences CSS (Intermédiaire) Java (Intermédiaire) PHP (Intermédiaire) XML (Intermédiaire) Coder (Avancé) Développer une application en lien avec une base de données (Avancé) Gestion de bases de données NoSQL (Avancé) HTML (Avancé) Programmation en Python (Avancé) Voir plus Voir moins"", ""Formation Baccalauréat Technologique\n\n| Bac ou équivalent 2017 Diplôme ou qualification obtenu(e). - Domaine de formation : Informatique Et Systèmes D'information Compétences CSS (Intermédiaire) Coder (Avancé) Développer une application en lien avec une base de données (Avancé) HTML (Avancé) Voir plus Voir moins""]","[""Expérience Data Engineer en alternance\n\n| Les Restos Du Coeur (Paris 9e arrondissement) de nov. 2021 à nov. 2023 (2 ans) En charge de différents projets dont la principale problématique sont la manipulation et la transformation de l'ensemble des données de l'association. Compétences Analyser, exploiter, structurer des données (Avancé) Coder (Avancé) Gestion de bases de données NoSQL (Avancé) Programmation en Python (Avancé) Voir plus Voir moins"", ""Expérience Analyste applicatif et Support Client\n\n| ZenSQL (Saint-Maur-des-Fossés) de sept. 2019 à sept. 2020 (1 an) - Analyse du besoin du client Dressage d'une solution adaptée aux attentes du client Implémentation de l'ERP\n- Création de supports pédagogiques sous forme de documentations\n- Support client pour la résolutions de problèmes Compétences Créer une documentation technique (Débutant) Accompagner l'appropriation d'un outil par ses utilisateurs (Intermédiaire) Coder (Avancé) Gérer et déployer des logiciels à distance (Avancé) Gestion de bases de données NoSQL (Avancé) Programmation en Python (Avancé) Voir plus Voir moins"", ""Expérience Stagiaire\n\n| ZenSQL (Saint-Maur-des-Fossés) de janv. 2019 à févr. 2019 (2 mois) Rédaction de scripts et de processus pour l'intégration et le traitement de correctifs d'une base de données à une autre Compétences Coder (Avancé) Gestion de bases de données NoSQL (Avancé) Programmation en Python (Avancé) Voir plus Voir moins""]","['Anglais technique', 'Application web', 'CSS', 'Gestion de bases de données NoSQL', 'HTML', 'Java', 'PHP', 'Programmation en Python', 'React.js', 'Script Shell', 'XML', 'Analyser, exploiter, structurer des données', 'Coder', 'Créer une documentation technique', 'Développer une application en lien avec une base de données', 'Gérer et déployer des logiciels à distance', 'Paramétrer un logiciel, un outil, un système numérique', 'Sélectionner, assembler et intégrer des composants informatiques (progiciels, bases de données, développements spécifiques, ...)', 'Vérifier la compatibilité des développements produits avec les spécifications', 'Ecrire une ou plusieurs langues étrangères', 'Parler une ou plusieurs langues étrangères', ""Accompagner l'appropriation d'un outil par ses utilisateurs"", 'Respecter la confidentialité des informations', 'Planifier et suivre les échéances de projet']","[""Être à l'écoute, faire preuve d'empathie"", ""Faire preuve d'autonomie"", 'Faire preuve de persévérance', 'Faire preuve de rigueur et de précision', 'Organiser son travail selon les priorités et les objectifs', 'Respecter ses engagements, assumer ses responsabilités', 'Travailler en équipe']","['Anglais', 'Malgache']",['B - Véhicule léger'],Administrateur de base de données
