formations,experiences,competences,Qualités,langues,permis,metier
"['Formation Master de SCIENCES, TECHNOLOGIES, SANTE Mention MIAGE\n\n| Bac+5 et plus ou équivalents 2024 Diplôme ou qualification obtenu(e). - Domaine de formation : Informatique Décisionnelle Voir plus Voir moins', 'Formation Master de SCIENCES, TECHNOLOGIES, SANTE Mention MIAGE\n\n| Bac+5 et plus ou équivalents 2024 Diplôme ou qualification obtenu(e).', 'Formation Maîtrise de SCIENCES, TECHNOLOGIES, SANTE Mention MIAGE\n\n| Bac+3, Bac+4 ou équivalents 2022 Diplôme ou qualification obtenu(e).', 'Formation Master de SCIENCES, TECHNOLOGIES, SANTE Mention MIAGE\n\n| Bac+3, Bac+4 ou équivalents 2022 Diplôme ou qualification obtenu(e). - Domaine de formation : Informatique De Gestion Voir plus Voir moins', 'Formation Baccalaureat Scientifique Lycee Paul Langevin - 60000 Beauvais\n\n| Bac ou équivalent 2019']","[""Expérience APPRENTI DÉVELOPPEUR FULL STACK\n\n| (AMIENS) de oct. 2023 à sept. 2024 (11 mois) Belive.ai - Captana - - Automatisation de processus avec des scripts Python et des tâches programmées, améliorant l'efficacité des opérations de données. Participation à des projets web et mobiles en tant que développeur full stack, améliorant l'expérience utilisateur. Création de reportings par email pour les clients avec des récapitulatifs et historiques des données. Compétences acquises : Créat Voir plus Voir moins"", ""Expérience STAGIAIRE DÉVELOPPEUR WEB\n\n| (AMIENS) de janv. 2023 à sept. 2023 (9 mois) Belive.ai - - Conception et implémentation d'un module de prévision et de réapprovisionnement pour optimiser la gestion des stocks à travers plusieurs enseignes. Gestion et analyse de grandes quantités de données pour améliorer le processus décisionnel et l'efficacité opérationnelle Compétences acquises : Analyse de données et prévision, Gestion de bases de données et Maîtrise de diverses technolo Voir plus Voir moins"", ""Expérience STAGIAIRE CHEF DE PROJET de avr. 2022 à août 2022 (5 mois) Communauté d'agglomération de Beauvaisis - Pilotage de la migration d'un serveur OwnCloud vers NextCloud, incluant la planification, la mise en oeuvre et le suivi, garantissant une transition sans interruption pour les utilisateurs. Évaluation et sélection de NextCloud pour répondre aux besoins de collaboration et de sécurité de l'organisation. Compétences acquises : Evaluation des besoins et plan Voir plus Voir moins""]","['Gestion de bases de données NoSQL', 'GitLab', 'Langages de programmation informatique', 'Microsoft Excel', 'Microsoft SQL Server', 'PHP', 'Programmation en JavaScript', 'Programmation en Python', 'Systèmes de gestion de base de données', 'Définir des modalités de collaboration', 'Gestion administrative du temps de travail', 'ETL', 'Grafana', 'La ponctualité', 'NoSQL']",[],"['Français', 'Anglais', 'Espagnol', 'Portugais']",['B - Véhicule léger'],Administrateur de base de données
"['Formation LA CAPSULE - Développeur FullS 2025', 'Formation Maitrise Génie des Système industriels\n\n| Bac+3, Bac+4 ou équivalents 2001 Diplôme ou qualification obtenu(e). - Domaine de formation : Génie Industriel Voir plus Voir moins', 'Formation maitrise GSI Génie des Systèmes Industriels\n\n| Bac+3, Bac+4 ou équivalents 2001 Diplôme ou qualification obtenu(e).', 'Formation Licence Génie des Système industriels\n\n| Bac+3, Bac+4 ou équivalents 2000 Diplôme ou qualification obtenu(e). - Domaine de formation : Génie Industriel Voir plus Voir moins', 'Formation Dut GEII Génie Electrique Et Informatique Industrielle\n\n| Bac+2 ou équivalents 1998 Diplôme ou qualification obtenu(e).', 'Formation DUT GEII Génie électrique et informatique industrielle\n\n| Bac+2 ou équivalents 1998 Diplôme ou qualification obtenu(e). - Domaine de formation : Génie Industriel Voir plus Voir moins', 'Formation BAC STI Génie électrotechnique\n\n| Bac ou équivalent 1995 Diplôme ou qualification obtenu(e). - Domaine de formation : Génie Industriel Voir plus Voir moins', 'Formation BAC STI Sciences Techniques Industrielles\n\n| Bac ou équivalent 1994 Diplôme ou qualification obtenu(e).']","[""Expérience Technicien d'exploitation SAP\n\n| oxya (Loos) de mai 2003 à juil. 2024 (21 ans et 3 mois) Suivi de sauvegarde, transport et surveillance SAP \nApplications sur Excel : traitement de données Voir plus Voir moins"", ""Expérience Stage de conception d'un logiciel de tests visuels en java\n\n| Laboratoire de recherche de l'E.N.I.C de févr. 2001 à juin 2001 (5 mois)"", ""Expérience Stage Technicien industriel\n\n| Valmex à les valenciennes – : métallurgique (Aulnoy) de avr. 1998 à juin 1998 (3 mois) Amélioration d'une chaine de production Voir plus Voir moins"", ""Expérience Stage dans une entreprise spécialiste des solutions logicielles et d'électronique embarquée notamment pour les machines agricoles\n\n| Agrotronix (Béthune) juin 1997"", ""Expérience Stage d'électricien\n\n| SODELEM (Duisans) juin 1996 installations électriques sur des chantiers de la région Hauts de France Voir plus Voir moins""]","['Autocad', 'Électricité', 'Électricité industrielle', 'Java', 'Microsoft Excel', 'Progiciel de gestion SAP', ""Administrer un système d'informations"", 'Développer une application en lien avec une base de données', ""Proposer des améliorations pour augmenter l'efficacité des systèmes"", 'Travailler en groupe, en réseau', 'Assembleur', 'Graphset', 'Unreal Engine (blueprint)']",[],"['Français', 'Anglais']","['A - Moto', 'B - Véhicule léger']",Administrateur de base de données
"[""Formation Licence pro en Analyse des Systèmes d'Information\n\n| Bac+3, Bac+4 ou équivalents 2013 Diplôme ou qualification obtenu(e). - Domaine de formation : Informatique Et Systèmes D'information Voir plus Voir moins"", ""Formation DEUG en Informatique\n\n| Bac+2 ou équivalents 2011 Diplôme ou qualification obtenu(e). - Domaine de formation : Informatique Et Systèmes D'information Voir plus Voir moins""]","[""Expérience Stage en alternance pour une Licence Pro Analyse des SI\n\n| DV Offshore de oct. 2012 à oct. 2013 (1 an) Expertise pour la restructuration des BDD de l'entreprise - évolution de Ms Access vers MySQL - Mise en place d'une solution de serveur local Wamp - Elaboration d'une interface utilisateur codée en PHP et Javascript Voir plus Voir moins""]","['Algorithmique', 'Logiciel de traitement de texte', ""Progiciels de gestion intégrée d'entreprise (ERP)"", ""Système d'exploitation AS 400"", ""Système d'exploitation Linux"", ""Système d'exploitation Solaris"", ""Système d'exploitation Unix"", ""Système d'exploitation Windows"", 'Utilisation de logiciels de tableur', ""Administrer un système d'informations"", 'Concevoir une application web', 'Créer une documentation technique', ""Déterminer des choix techniques d'architecture logicielle et matérielle et sélectionner des technologies, matériels, logiciels, configurations"", 'Développer une application en lien avec une base de données', 'Paramétrer un logiciel, un outil, un système numérique', ""Réaliser la mise en production de solutions logicielles dans un environnement d'exploitation"", 'Sélectionner, assembler et intégrer des composants informatiques (progiciels, bases de données, développements spécifiques, ...)', 'Concevoir une maquette de présentation', ""Réaliser un prototype de la solution technique pour validation par le donneur d'ordres (configuration type, ...)"", 'Promouvoir une proposition, un projet', ""Accompagner l'appropriation d'un outil par ses utilisateurs"", 'Réaliser un diagnostic technique', ""Surveiller le fonctionnement d'applicatifs et logiciels"", 'Recueillir et analyser les besoins client', 'Superviser et coordonner les réalisations, études ou développements informatiques (collaborateurs, sous-traitants)', 'base de données']","[""Faire preuve d'autonomie""]","['Anglais', 'Espagnol']",[],Administrateur de base de données
"[""Formation Bachelor / Administrateur système et réseaux Option Bases de données\n\n| Bac+3, Bac+4 ou équivalents 2024 Architecture réseau\nAdministration quotidienne d'un système d'information.\nMaintien en condition opérationnelles d'un réseau et évolution de celui ci.\nGestion des dysfonctionnements, des utilisateurs.\nGestion et administration de bases de données.\nCloud computing.\nGestion de la relation avec des prestataires\nGestion de projets informatique. - Domaine de formation : Informatique Et Systèmes D'information Voir plus Voir moins"", ""Formation Qualification administrateur base de données (TP ou LP) - Responsable en ingénierie systèmes et rése 2024 Compétences Déploiement de services cloud (cloud computing) Docker Gestion de versions de logiciels de jeux Microsoft Active Directory MySQL proxmox Système d'exploitation informatique VMWare (virtualisation d'architecture) Système de Gestion de Bases de Données (SGBD) (Avancé) Voir plus Voir moins"", 'Formation Remise à niveau professionnel dans les métiers du numérique niveau supérieur 2023 Compétences Déploiement de services cloud (cloud computing) Docker Gestion de versions de logiciels de jeux MySQL proxmox Voir plus Voir moins', ""Formation TECHNICIEN SUP.GESTIONNAIRE DE RESSOURCES INFORMATIQUES AFPA\n\n| Bac+2 ou équivalents 2005 Diplôme ou qualification obtenu(e). Obtenu à l'AFPA deDijon:  Sujet de stage : création d'un annuaire et migration d'une solution Novell vers un annuaire Novell - Domaine de formation : Informatique Et Systèmes D'information Compétences Microsoft Active Directory MySQL Algorithmique (Intermédiaire) Proposer des améliorations pour augmenter l'efficacité des systèmes (Intermédiaire) Rédiger un script (Intermédiaire) Système multiprocesseurs (Intermédiaire) Analyser, résoudre un problème courant ou complexe (Avancé) Apporter une assistance technique aux équipes (Avancé) Configurer le poste de travail aux besoins de l'utilisateur (Avancé) Gérer les droits d'accès des utilisateurs (Avancé) Règles de sécurité Informatique et Télécoms (Avancé) Renseigner les supports de suivi d'intervention (Avancé) Système d'exploitation Windows (Avancé) Système de Gestion de Bases de Données (SGBD) (Avancé) Système réseau (LAN, MAN, WAN) (Avancé) Voir plus Voir moins"", ""Formation ELECTROTECHNIQUE\n\n| CAP, BEP et équivalents 1995 Diplôme ou qualification obtenu(e). Effectué àl'AFPA du creusot (71200) - Domaine de formation : Électricité Voir plus Voir moins""]","[""Expérience Administrateur réseau\n\n| Cisapli Pli services (reims) de mars 2024 à juin 2024 (4 mois) Stage en entreprise. Sujet du stage: Modernisation de l'infrastructure d'une tpe. Mise à jour complète logicielle et matérielle d'une infrastructure agée de 10 ans au sein de cette tpe Voir plus Voir moins"", 'Expérience Téléconseiller\n\n| Comdata (chalon sur saone, 71) de sept. 2020 à janv. 2022 (1 an et 5 mois) Téléconseiller service client  Orange: Renseignements commerciaux des clients, résolution des problématiques commerciales (commandes non reçues), encaissement et explications de factures, ventes de services additionnels Voir plus Voir moins', ""Expérience Téléconseiller \n\n| Webhelp (71300 Montceau Les Mines) de sept. 2019 à déc. 2019 (4 mois) Téléconseiller.Client donneur d'ordre: Vattenfall. Service client pour un fournisseur d'énérgie. Clientèle particuliers et professionnels. Voir plus Voir moins"", ""Expérience Technicien support informatique\n\n| (Reims) de oct. 2015 à nov. 2015 (2 mois) Technicien support informatique pour le datacenter Ikoula de Reims Compétences Accompagner l'appropriation d'un outil par ses utilisateurs Changer ou réparer une pièce ou un ensemble défectueux Analyser, résoudre un problème courant ou complexe (Avancé) Apporter une assistance technique aux équipes (Avancé) Configurer le poste de travail aux besoins de l'utilisateur (Avancé) Renseigner les supports de suivi d'intervention (Avancé) Système d'exploitation Linux (Avancé) Voir plus Voir moins"", ""Expérience Indépendant en informatique de mai 2012 à déc. 2017 (5 ans et 8 mois) Dépannage, déploiment et maintenance réseau. Aide aux utilisateurs concernant l'utilisation de l'informatique Création,administration de sites web. Administration de serveurs Windows et Debian. Gestion des accès et des services (FTP, messagerie) Compétences Gestion de versions de logiciels de jeux Microsoft Active Directory MySQL Système d'exploitation informatique VMWare (virtualisation d'architecture) Accompagner l'appropriation d'un outil par ses utilisateurs Langages de programmation informatique Conseiller des équipes de développement, de production et des utilisateurs (Débutant) Algorithmique (Intermédiaire) Gestion de la relation client (CRM) (Intermédiaire) Proposer des améliorations pour augmenter l'efficacité des systèmes (Intermédiaire) Réaliser les interventions de télémaintenance (Intermédiaire) Rédiger un script (Intermédiaire) Système multiprocesseurs (Intermédiaire) Administration de serveurs de messagerie (Avancé) Administrer un site web (Avancé) Administrer un système d'informations (Avancé) Analyser, résoudre un problème courant ou complexe (Avancé) Apporter une assistance technique aux équipes (Avancé) Attribuer des ressources logistiques et matérielles de réseaux (Avancé) Configurer le poste de travail aux besoins de l'utilisateur (Avancé) Gérer les droits d'accès des utilisateurs (Avancé) Installer un équipement informatique (Avancé) Intégrer un script (Avancé) Règles de sécurité Informatique et Télécoms (Avancé) Renseigner les supports de suivi d'intervention (Avancé) Système d'exploitation Linux (Avancé) Système d'exploitation Windows (Avancé) Système de Gestion de Bases de Données (SGBD) (Avancé) Système réseau (LAN, MAN, WAN) (Avancé) Voir plus Voir moins"", ""Expérience TECHNICIEN SUPPORT\n\n| TELEPERFORMANCE de avr. 2006 à avr. 2010 (4 ans) Compétences Accompagner l'appropriation d'un outil par ses utilisateurs Techniques de vente par téléphone (Débutant) Apporter une assistance technique aux équipes (Avancé) Développer et fidéliser la relation client (Avancé) Effectuer le suivi des commandes, la facturation (Avancé) Présenter et valoriser un produit ou un service (Avancé) Renseigner les supports de suivi d'intervention (Avancé) Vérifier la disponibilité d'un produit (Avancé) Voir plus Voir moins""]","['Administration de serveurs de messagerie', 'Algorithmique', 'Argumentation commerciale', 'Déploiement de services cloud (cloud computing)', 'Docker', 'Gestion de la relation client (CRM)', 'Gestion de versions de logiciels de jeux', 'Langages de programmation informatique', 'Logiciel de traitement de texte', 'Microsoft Active Directory', 'MySQL', ""Système d'exploitation informatique VMWare (virtualisation d'architecture)"", ""Système d'exploitation Linux"", ""Système d'exploitation Windows"", 'Système de Gestion de Bases de Données (SGBD)', 'Système multiprocesseurs', 'Système réseau (LAN, MAN, WAN)', 'Utilisation de logiciels de tableur', ""Administrer un système d'informations"", 'Attribuer des ressources logistiques et matérielles de réseaux', ""Configurer le poste de travail aux besoins de l'utilisateur"", 'Gérer la sécurité informatique', ""Gérer les droits d'accès des utilisateurs"", 'Installer un équipement informatique', 'Intégrer un script', ""Proposer des améliorations pour augmenter l'efficacité des systèmes"", 'Analyser les performances système régulièrement', 'Changer ou réparer une pièce ou un ensemble défectueux', ""Diagnostiquer la nature et l'origine des incidents et mettre en oeuvre les mesures correctives"", 'Réaliser les interventions de télémaintenance', ""Accompagner l'appropriation d'un outil par ses utilisateurs"", 'Conseiller, accompagner une personne', 'Conseiller des équipes de développement, de production et des utilisateurs', 'Développer et fidéliser la relation client', 'Présenter et valoriser un produit ou un service', 'Apporter une assistance technique aux équipes', 'Assurer un accueil téléphonique', 'Techniques commerciales', 'Techniques de vente par téléphone', ""Renseigner les supports de suivi d'intervention"", 'Rédiger un script', 'Effectuer le suivi des commandes, la facturation', ""Vérifier la disponibilité d'un produit"", 'Règles de sécurité Informatique et Télécoms', 'Utiliser les outils numériques', ""Vérifier l'identité et les coordonnées de l'interlocuteur"", 'Analyser, résoudre un problème courant ou complexe', 'Administrer un site web', 'Administration et gestion de serveurs Debian', 'Administration et gestion de sevreurs Windows', 'Administration et maintenance de serveurs', 'annuaires Active directory et Openldap', 'Architecture reseaux lan, wan', 'Autonomie, calme et patience', 'Base de données : UML, Merise, Sql, Mysql et Ms_sql', 'Contact Client', 'Dépannage et gestion des postes utilisateurs', 'Gestion des utilisateurs, matériels et logiciels SI', 'Programmation orientée Web (PHP, HTML5, Javscript, CSS°', 'proxmox', 'Rigueur, fiablité et respect des procédures', 'Sécurité des reseaux et périphériques']","['Avoir le sens du service', ""Être à l'écoute, faire preuve d'empathie"", ""Faire preuve d'autonomie"", 'Faire preuve de curiosité', 'Faire preuve de réactivité', 'Faire preuve de rigueur et de précision', 'Gérer son stress', 'Prendre des initiatives et être force de proposition', ""S'adapter aux changements"", 'Travailler en équipe']",['Anglais'],[],Administrateur de base de données
[],[],"['Administrer des ressources informatiques', 'Configurer les équipements réseau et serveurs', 'Déployer des solutions de réseau sans fil', 'Habilitation Agent de prévention et de sécurité', 'Suivre les livraisons, régler les réclamations liées au service après-vente, en liaison avec les services commercial, achats, production, technique, logistique', ""Systèmes d'information de gestion"", 'Administrer un site web']","['Avoir le sens du service', 'Faire preuve de rigueur et de précision', 'Organiser son travail selon les priorités et les objectifs', ""S'adapter aux changements"", 'Travailler en équipe']","['Anglais', 'Français']",['B - Véhicule léger'],Administrateur de base de données
"['Formation Licence MIASHS\n\n| Bac+3, Bac+4 ou équivalents 2020 Diplôme ou qualification obtenu(e). - Domaine de formation : Mathématiques Informatiques Voir plus Voir moins']",[],"['Algorithmique', 'Système de Gestion de Bases de Données (SGBD)']",[],"['Français', 'Anglais']",[],Administrateur de base de données
"[""Formation Administarteur de beses de données\n\n| Bac+2 ou équivalents 2006 Diplôme ou qualification obtenu(e). Stage de fin d'études à l'Institut Supérieur des Matériaux et Mécaniques Avancés 'ISMANS', analyse et refonte de la base de données étudiants et professeurs. - Domaine de formation : Informatique Et Systèmes D'information Compétences Pratique professionnelle des outils office, Windows et Mac (Avancé) Techniques pédagogiques (Avancé) Voir plus Voir moins"", ""Formation BTS: Informatique de gestion\n\n| Bac+2 ou équivalents 1997 Diplôme ou qualification obtenu(e). Stage de fin d'études en agence bancaire, conception et sécurisation de la base de données. - Domaine de formation : Informatique Et Systèmes D'information Compétences Pratique professionnelle des outils office, Windows et Mac (Avancé) Stratégies de communication digitale (Avancé) Techniques pédagogiques (Avancé) Voir plus Voir moins""]","[""Expérience Conseillé clientèle en assurance  \n\n| Comdata pour AXA Assurance  (Le mans) de juin 2022 à janv. 2023 (8 mois) Le traitement d'appels entrants pour particuliers, professionnelle, agents et courtiers.\nExplication de quittances, gestion des règlements et le suivi des cotisations. Compétences Pratique professionnelle des outils office, Windows et Mac (Avancé) Présenter et valoriser un produit ou un service (Avancé) Voir plus Voir moins"", ""Expérience Conseiller clientèle qualité\n\n| O2 Développement  Le Mans (Le Mans) de mai 2017 à févr. 2022 (4 ans et 10 mois) Traitement des demandes clients et assistance aux intervenants. Compétences Assurer un accueil téléphonique (Avancé) Pratique professionnelle des outils office, Windows et Mac (Avancé) Stratégies de communication digitale (Avancé) Techniques pédagogiques (Avancé) Utiliser les outils numériques (Avancé) Vérifier l'identité et les coordonnées de l'interlocuteur (Avancé) Voir plus Voir moins"", 'Expérience Auto-entrepreneur en Informatique de juin 2014 à mars 2017 (2 ans et 10 mois) Initiation et installation du matériel informatique pour  particuliers et professionnels,  pc et box en assurant les interventions de maintenances. Compétences Assurer un accueil téléphonique (Avancé) Pratique professionnelle des outils office, Windows et Mac (Avancé) Stratégies de communication digitale (Avancé) Techniques pédagogiques (Avancé) Voir plus Voir moins', 'Expérience Conseiller clientèle\n\n| TELEPERFORMANCE  Le Mans de mai 2008 à mai 2014 (6 ans) Gestion des abonnements mobiles et le suivi après-vente du matériel pour les particuliers et les professionnels, ""Client SFR"". Compétences Assurer un accueil téléphonique (Avancé) Pratique professionnelle des outils office, Windows et Mac (Avancé) Stratégies de communication digitale (Avancé) Techniques pédagogiques (Avancé) Voir plus Voir moins', 'Expérience Technicien réseau\n\n| B2S  Le Mans de sept. 2006 à avr. 2008 (1 an et 8 mois) Assistance technique et résolution de pannes, réseau informatique ou télécoms, ""Client TELE2"". Compétences Assurer un accueil téléphonique (Avancé) Pratique professionnelle des outils office, Windows et Mac (Avancé) Stratégies de communication digitale (Avancé) Techniques pédagogiques (Avancé) Voir plus Voir moins']","['Application web', 'Argumentation commerciale', 'Assurances', 'Gestion des relations clientèle', 'Logiciel de traitement de texte', 'Stratégies de communication digitale', ""Systèmes d'information de gestion"", 'Utilisation de logiciels de tableur', 'Visual Basic', 'Analyser, exploiter, structurer des données', 'Développer une application en lien avec une base de données', ""Réaliser des études d'organisation et d'évolution de systèmes d'information"", 'Sélectionner, assembler et intégrer des composants informatiques (progiciels, bases de données, développements spécifiques, ...)', ""Tester un logiciel, un système d'informations, une application"", 'Assurer un service après-vente', 'Développer et fidéliser la relation client', 'Présenter et valoriser un produit ou un service', 'Assurer un accueil téléphonique', ""Proposer une solution d'assistance (envoi de médecin, hospitalisation, rapatriement, ...)"", 'Recueillir et analyser les besoins client', 'Techniques commerciales', 'Techniques de vente par téléphone', 'Techniques pédagogiques', 'Respecter la confidentialité des informations', 'Utiliser les outils numériques', 'Déterminer des mesures correctives', ""Surveiller le fonctionnement d'applicatifs et logiciels"", ""Prendre une décision et l'expliquer"", 'Conseiller, accompagner une personne', 'Effectuer le suivi des commandes, la facturation', 'Réaliser un diagnostic technique', 'Marketing téléphonique', ""Vérifier l'identité et les coordonnées de l'interlocuteur"", 'Concevoir et gérer un projet', 'Pratique professionnelle des outils office, Windows et Mac']","['Avoir le sens du service', ""Être à l'écoute, faire preuve d'empathie"", ""Faire preuve d'autonomie"", ""Faire preuve de créativité, d'inventivité"", 'Faire preuve de curiosité', 'Faire preuve de leadership', 'Faire preuve de persévérance', 'Faire preuve de réactivité', 'Faire preuve de rigueur et de précision', 'Gérer son stress', 'Organiser son travail selon les priorités et les objectifs', 'Prendre des initiatives et être force de proposition', 'Respecter ses engagements, assumer ses responsabilités', ""S'adapter aux changements"", 'Travailler en équipe']",['Anglais'],['B - Véhicule léger'],Administrateur de base de données
