formations,experiences,competences,Qualités,langues,permis,metier
"[""Formation Dundalk Institute of Technology\n\n| Bac+3, Bac+4 ou équivalents 2011 Diplôme ou qualification obtenu(e). - Domaine de formation : Informatique Et Systèmes D'information Voir plus Voir moins"", ""Formation Athboy Community School \n\n| Bac ou équivalent 2008 Diplôme ou qualification obtenu(e). - Domaine de formation : Mathématiques - Formation effectuée à l'étranger Voir plus Voir moins""]",[],"['Big data Analytics', 'Business Intelligence (BI) / Informatique décisionnelle', 'Développement économique', 'Gestion des relations clientèle', 'GRH', 'Intelligence économique', 'Langages de programmation informatique', 'Modélisation et simulation', 'Adapter les outils de traitement statistique de données', 'Analyser, exploiter, structurer des données', ""Assister une structure dans l'interprétation et l'analyse d'une étude"", ""Définir et faire évoluer des procédés de traitement de l'information"", 'Réaliser un modèle de prévision', 'Analyser les tendances de consommation des clients', 'Concevoir des modèles de détection des insights consommateurs', 'Contractualiser une prestation', 'Développer un portefeuille clients et prospects', 'Concevoir et gérer un projet', 'Diriger et gérer un ensemble, une structure, une organisation', 'Établir des prévisions, des évaluations, des recommandations, des perspectives', ""Mettre en place des outils d'aide à la décision"", 'Réaliser des études spécifiques', 'Réaliser une étude', 'Réaliser une étude quantitative', ""Analyse de l'audience cible"", 'Gérer les ressources humaines', 'Techniques commerciales', 'Marketing / Mercatique', 'Modélisation économique', 'Communiquer les résultats des études aux parties prenantes', ""Rédiger de l'information"", 'Transmettre une technique, un savoir-faire', 'Élaborer, suivre et piloter un budget', 'Animer, coordonner une équipe']",[],"['Anglais', 'Français']","['A - Moto', 'B - Véhicule léger']",Administrateur de base de données
"['Formation BEP\n\n| CAP, BEP et équivalents 1983 - Domaine de formation : Comptabilité Voir plus Voir moins']",[],[],[],[],['B - Véhicule léger'],Administrateur de base de données
"[""Formation Titre professionnel concepteur développeur d'applications 2024 Compétences Concevoir des maquettes et pré-maquettes (Intermédiaire) Gestion de bases de données NoSQL (Intermédiaire) Programmation en JavaScript (Intermédiaire) React.js (Intermédiaire) Voir plus Voir moins"", 'Formation Developpeur Web / Web Mobile\n\n| Bac+2 ou équivalents 2023 Diplôme ou qualification obtenu(e). DWWM est une formation permettant la maitrise de langages informatiques afin de réaliser des interfaces Web.\n( Ex : PHP / CSS / HTML / SQL ) - Domaine de formation : Langages Informatiques Compétences Gestion de bases de données NoSQL (Intermédiaire) Voir plus Voir moins', 'Formation MS Développeur PHP 2023', 'Formation F O R M A T I O N 2021', 'Formation Langues Vivantes Étrangères\n\n| Bac+2 ou équivalents 2020 - Domaine de formation : Langues Voir plus Voir moins', 'Formation Ssiap Au Crefo De Saint Pol Sur Mer 2020', 'Formation BTS Électrotechnique\n\n| Bac+2 ou équivalents 2017 Diplôme ou qualification obtenu(e). - Domaine de formation : Électronique Voir plus Voir moins', ""Formation Bac Scientifique Au Lycee De L'europe Grande Synthe)\n\n| Bac ou équivalent 2015 Diplôme ou qualification obtenu(e)."", 'Formation Bts Electrotechnique Au Lycee De L Europe Grande Synthe)\n\n| Bac ou équivalent 2015']","[""Expérience Agent de Sécurité SSIAP\n\n| Samsic (Centre Marine de Dunkerque) de janv. 2022 à mars 2022 (3 mois) Janvier 2022 - Mars 2022  :  Emploi  au centre Marine de Dunkerque en tant qu'agent SSIAP Voir plus Voir moins"", 'Expérience Agent de Sécurité \n\n| GSE de déc. 2021 à janv. 2022 (2 mois)', ""Expérience Evenementiel \n\n| Event Security déc. 2021 2 Evenementiels en tant qu'agent de sécurité pour Event Sécurity. Voir plus Voir moins"", 'Expérience Teleconseiller\n\n| Capdunes juil. 2019 Téléconsei l ler à Capdunes à Coudekerque Branche  (15 Jours) Voir plus Voir moins', 'Expérience 2\n\n| MAIRIE (Saint) de déc. 2018 à janv. 2020 (1 an) 00  :  Téléconsei l ler à Capdunes à Coudekerque Branche  (15 Jours) 018  :  Emploi  saisonnier pour  la Mairie de Saint Pol  sur mer  (15 Jours) Voir plus Voir moins']","['Application web', 'Gestion de bases de données NoSQL', 'Informatique', 'Programmation en JavaScript', 'React.js', 'Concevoir une application web', 'Concevoir des maquettes et pré-maquettes', 'Recueillir et analyser les besoins client', 'Aisance Sociale']",[],"['Français', 'Anglais']",['B - Véhicule léger'],Administrateur de base de données
"['Formation Licence professionnelle Pharmacovigilance et autres vigilances - ENCPB\n\n| Bac+3, Bac+4 ou équivalents 2022 Diplôme ou qualification obtenu(e). - Domaine de formation : Pharmacologie Voir plus Voir moins', 'Formation PHARMACOVIGILANCE ET AUTRES VIGILANCES\n\n| Bac+3, Bac+4 ou équivalents 2022 Diplôme ou qualification obtenu(e). - Domaine de formation : Pharmacologie Voir plus Voir moins', 'Formation BTS Bioanalyses et contrôles\n\n| Bac+2 ou équivalents 2021 Diplôme ou qualification obtenu(e).']","[""Expérience Gestionnaire de Base de Données en Pharmacovigilance\n\n| HAYS pour le compte du laboratoire UPSA (Paris) de juin 2023 à juin 2024 (1 an) - Saisie des données de vigilances dans la base d e données suivant le guide utilisateur de la base de données,\n- Codage MedDRA,\n- Rédaction des narratifs en anglais \n- Gestion de la boite à lettre générique\n- Téléchargement des cas issus d'Eudravigilance,\n- Soumission des cas aux autorités de santé, aux filiales et aux partenaires,\n- Archivage des documents sources Voir plus Voir moins"", 'Expérience Gestionnaire de Pharmacovigilance\n\n| Mission au Laboratoire Roche (CDI de Portage Salarial avec Hays) (Boulogne Billancourt) de oct. 2022 à juin 2023 (9 mois) - Soumission de cas de PV aux autorités de Santé, via un module dédié (ArisG).\n- Gestion d es boites mails génériques d e PV : aiguillage de mail. \n- Soutien aux a activités de réconciliations et contrôle qualité de certaines activités.\n- Soutien aux activités de suivi de la Compliance des cas de PV. \n- Soutien sur le suivi des activités digitales et mise à jour de kit de formation. Voir plus Voir moins', 'Expérience Assistante de Pharmacovigilance\n\n| Insitut Gustave Roussy (Villejuif) de sept. 2021 à sept. 2022 (1 an) - Gestion des cas de pharmacovigilance : saisie dans le base de données, codage, rédaction des narratifs, déclaration aux autorités, suivi, archivage.\n - Aide à la préparation des rapports annuels de sécurité et des réunions des comités indépendants de suivi: réconciliation des données, préparation des tableaux et listings Voir plus Voir moins']","['Analyser la qualité des process', 'Contrôler des données qualité', 'Contrôler la qualité et la conformité des process', ""Piloter une démarche qualité, un processus d'amélioration continue"", 'Favoriser un environnement de travail collaboratif', 'Contrôler la conformité des données', 'Réaliser une veille documentaire', 'Capacité à rédiger, interpréter et analyser les cas', 'Former les nouveaux collaborateurs aux outils', ""Maîtrise de l'anglais opérationnel"", 'Réconciliation des données', 'Travailler dans un environnement règlementé complexe', 'Utilisation des logiciels de base de données']",[],"['Français', 'Anglais']",[],Administrateur de base de données
"[""Formation INSA Rouen Ingenieur en Génie mathématiques\n\n| Bac+5 et plus ou équivalents 2012 Diplôme ou qualification obtenu(e). Diplôme d'ingénieur en Mathématiques, Statistiques, Recherche Opérationnelle et Informatique. - Domaine de formation : Mathématiques Voir plus Voir moins""]","['Expérience GESTIONNAIRE BASE DE DONNEES\n\n| UNICID (PARIS) de janv. 2024 à août 2024 (8 mois)', 'Expérience gestionnaire base de données\n\n| SIEMENS HEALTCARE (LA DEFENSE) de févr. 2023 à déc. 2023 (11 mois) Mise à jour de la base de données PARC dans SAP \nTraiter le suivi des anomalies du parc d’équipement chez les clients\nGénérer les comptes-rendus des réunions\nSuivre les modifications reçues de la maison mère via à Power BI Voir plus Voir moins', ""Expérience chargé de base de données e-commerce\n\n| invivo retail (la defense) de mai 2020 à sept. 2022 (2 ans et 5 mois) Gestion base de données PIM, verification cohérence et fiabilité des données, extraction, contact avec l'offre et les fournisseurs pour récupérer les données exactes. Akeneo Excel Voir plus Voir moins"", ""Expérience ADMINISTRATEUR BASES DE DONNEES\n\n| KENT POMONA (Antony) de nov. 2017 à mars 2018 (5 mois) Dans le cadre d'un projet de déploiement et d'enrichissement de données en \nsuccursale, au sein de la DSI et plus précisément, de l'équipe centrale de données,\nMaintenance de la base de données Clients\nCréation, Modification de Requêtes d'initialisation et de controle de la qualité et complétude des données sous Access et SQL Server\nSuivi des Anomalies selon leurs niveaux de Criticité \nIntégration Compétences Système de Gestion de Bases de Données (SGBD) Voir plus Voir moins"", ""Expérience Gestionnaire de statistique , reporting & bases de données\n\n| Bibliotheque nationale de France de juil. 2016 à févr. 2017 (8 mois) Edition de rapports statistiques courants sur les flux de données\nContrôle de la qualité des données\nCréation de requêtes et rapports sous COGNOS\nCréation de tableaux de bords\nCréation de commandes, paramètrage et création d'articles dans la base de données Voir plus Voir moins"", ""Expérience Chargé d'études (domaine : statistiques) \\ Programmeur SAS\n\n| Ag2R La Mondiale de févr. 2014 à juin 2015 (1 an et 5 mois) CDD 18 mois Chartres 28 000: Statistiques et Analyse de données sur la retraite complémentaire ARRCO-AGIRC, Reporting, Suivi et bilan pour l'information des actifs, Définition et calcul de profils de retraite. Programmation SAS et EXCEL. Voir plus Voir moins"", ""Expérience Chargé d'études (domaine: statistiques) \\Programmeur SAS\n\n| SNCF Voyage de juin 2012 à déc. 2012 (7 mois) Modélisation des courbes de préférences horaires des voyageurs selon le type de jour. Classification, Segmentation, Régression log-linéaire. Base de données, Statistiques et Programmation SAS (SAS Base/Graph/Stat, Enterprise Miner). Voir plus Voir moins"", ""Expérience Chargé d'études et modélisation 3D\n\n| STX Europe de juil. 2010 à sept. 2010 (3 mois) Stage Technicien 3 mois Saint-Nazaire Analyse et Modélisation de déformations créées par des soudures sur des nappes d'acier. Analyse des données (Résidu, Régression non linéaire...). Utilisation de fonctions Splines pour modélisation. Voir plus Voir moins""]","['Algorithmique', 'Analyse de données expérimentales', 'Big data Analytics', 'Langages de programmation informatique', 'Logiciel de traitement de texte', 'Logiciels de gestion de base de données', 'Statistiques appliquées', 'Système de Gestion de Bases de Données (SGBD)', 'Utilisation de logiciels de tableur', 'Adapter les outils de traitement statistique de données', ""Définir et faire évoluer des procédés de traitement de l'information"", 'Réaliser une veille documentaire', 'Utiliser les outils numériques', 'Communiquer les résultats des études aux parties prenantes', ""Rédiger de l'information"", 'Réaliser une étude', 'ACCESS', 'Analyse de Données', 'BASES de données', 'Classification et Segmentation', 'COGNOS', 'EXCEL', 'Logiciels R et Matlab', 'Programmation C', 'Programmation SAS et SQL, VBA', 'Régression linéaire et non linéaire', 'Reporting', 'SAP', 'SQL', 'SQL SERVER', 'Statistiques & Probabilités', 'WORD']",[],"['Anglais', 'Espagnol']",['B - Véhicule léger'],Administrateur de base de données
"['Formation Licence Archives et patrimoine industriel culturel administratif\n\n| Bac+3, Bac+4 ou équivalents 2009 Diplôme ou qualification obtenu(e). - Domaine de formation : Communication Et Information Voir plus Voir moins', 'Formation DUT Information et communication\n\n| Bac+2 ou équivalents 2008 Diplôme ou qualification obtenu(e). - Domaine de formation : Communication Et Information Voir plus Voir moins', 'Formation Baccalauréat Littéraire\n\n| Bac ou équivalent 2006 Diplôme ou qualification obtenu(e). Mention Bien (15,6/20) - Domaine de formation : Langues Voir plus Voir moins']","[""Expérience Assistante livre numérique\n\n| Editions Odile Jacob de août 2009 à nov. 2015 (6 ans et 4 mois) Rattachée au service Fabrication du livre, mais seule aux commandes du livre numérique : depuis la signature de contrat d'auteur jusqu'à la vente sur les plateformes internet Voir plus Voir moins""]","['Classer des documents', 'Gérer une base documentaire', 'Maintenir une documentation précise et à jour', 'Réaliser une veille documentaire', 'Sélectionner des informations documentaires', 'Utiliser les outils numériques', 'Gestion administrative', 'Lecture en public', 'Logiciel de gestion documentaire', ""Logiciels d'édition multimédia"", ""Sciences de l'information et des bibliothèques"", 'Techniques de communication orales, écrites et numériques', 'Techniques de conservation de documents', 'Techniques de restauration de documents', 'Droit de la propriété intellectuelle', ""Méthode de classement et d'archivage"", 'Prendre la parole en public', 'Discrétion', 'Rigueur']","[""Faire preuve d'autonomie"", 'Faire preuve de curiosité', 'Faire preuve de rigueur et de précision', 'Organiser son travail selon les priorités et les objectifs', ""S'adapter aux changements""]",['Allemand'],"['B - Véhicule léger', 'B mention 96 - VL + remorque (PTAC < 4,25 T)']",Administrateur de base de données
"['Formation Master Administration et échanges internationaux\n\n| Bac+5 et plus ou équivalents Cette Formation contient une pièce jointe 2022 - Domaine de formation : Marketing Pièces jointes .pdf Voir plus Voir moins', 'Formation Licence en Administration et échanges internationaux\n\n| Bac+3, Bac+4 ou équivalents Cette Formation contient une pièce jointe 2020 Diplôme ou qualification obtenu(e). - Domaine de formation : Gestion Organisations Pièces jointes .pdf Voir plus Voir moins', 'Formation Cette Formation contient une pièce jointe 2017 - Domaine de formation : Économie Sociale Pièces jointes .pdf Voir plus Voir moins']",[],"[""Concevoir la campagne promotionnelle d'un produit"", 'Élaborer une stratégie de marketing digital', 'Élaborer un plan marketing, une stratégie de marque et de communication', ""Évaluer l'impact d'une stratégie marketing"", 'Mettre en oeuvre des actions commerciales et promotionnelles', 'Mettre en œuvre des campagnes de marketing ciblées', 'Marketing des réseaux sociaux', 'Techniques de marketing digital', ""Concevoir des supports de communication et d'image"", 'Webmarketing', ""Rédiger un rapport, un compte rendu d'activité"", 'Utiliser les outils numériques']","[""Faire preuve d'autonomie"", 'Faire preuve de curiosité', 'Faire preuve de persévérance', 'Organiser son travail selon les priorités et les objectifs', ""S'adapter aux changements""]","['Turc', 'Anglais', 'Allemand']",['B - Véhicule léger'],Administrateur de base de données
