formations,experiences,competences,Qualités,langues,permis,metier
"['Formation CNAM Formation à distance Anglais professionel niveau C1\n\n| Bac+3, Bac+4 ou équivalents Cette Formation contient une pièce jointe 2023 ANGLAIS Professionel niveau C1 - Domaine de formation : Anglais Commercial Pièces jointes .pdf Voir plus Voir moins', 'Formation CNAM Formation à distance ""Certificat Professionnel Développeur de sites Web""\n\n| Bac+2 ou équivalents 2023 Développer un site web, dans un environnement Windows/Linux\nÉtudier les langages dévolus à la création de pages web et à la création de base\nde données\nÉtudier l\'installation et l\'administration de serveurs web: couches systèmes,\nréseaux et services\nAcquérir les concepts fondamentaux de l\'infographie - Domaine de formation : Informatique De Gestion Voir plus Voir moins', ""Formation CNAM Formation à distance Excel Niveau avancé\n\n| Bac+2 ou équivalents 2023 Niveau avancé\nMaîtriser les fonctions avancées d'Excel,\nVerrouiller un classeur, une feuille, des cellules ; menus déroulants et multidéroulants\nMaîtriser les dates, heures, calculs de temps, gestion de planning,\nUtiliser des formules élaborées et imbriquées,\nUtiliser des formules multicritères,\nCréer des graphiques avancés de synthèse, superposition de graphes, graphes multiéchelles... - Domaine de formation : Logiciel Excel Voir plus Voir moins"", ""Formation SAP Administration des Ventes pour Utilisateurs finaux Cette Formation contient une pièce jointe 2021 Assimiler les principaux processus de gestion de l'administration des ventes\n- Comprendre les interactions avec les autres modules, tels que les stocks, la production ou la finance - Maîtriser les éléments nécessaires pour la réalisation du processus, tels que les structures organisationnelles et les données de base - Connaître les principales transactions de SAP de l'Administration des Ventes Pièces jointes .pdf Voir plus Voir moins"", 'Formation TOEIC ANGLAIS (860 points sur 990)\n\n| Bac+2 ou équivalents 2013 Diplôme ou qualification obtenu(e). - Domaine de formation : Langues Compétences Concevoir une application web (Avancé) Voir plus Voir moins', ""Formation DEST CNAM Ingénierie et Intégration informatique\n\n| Bac+3, Bac+4 ou équivalents 2006 Diplôme ou qualification obtenu(e). Ingénierie et Intégration informatique: système d'information - Domaine de formation : Informatique Et Systèmes D'information Compétences Algorithmique (Intermédiaire) Déterminer des mesures correctives (Intermédiaire) Langages de programmation informatique (Intermédiaire) Système informatique (embarqué ou fixe) (Intermédiaire) Voir plus Voir moins"", ""Formation Diplôme d'Anglais des Affaires\n\n| Bac+3, Bac+4 ou équivalents 2004 Diplôme ou qualification obtenu(e). Chambre de Commerce franco-britannique - Domaine de formation : Langues Voir plus Voir moins"", ""Formation DUT Informatique de Gestion\n\n| Bac+2 ou équivalents 1990 Diplôme ou qualification obtenu(e). IUT de Paris (Université René Descartes) - Domaine de formation : Informatique Et Systèmes D'information Compétences Langages de programmation informatique (Intermédiaire) Gestion de bases de données NoSQL (Avancé) Voir plus Voir moins"", 'Formation Baccalauréat D, Mention Bien\n\n| Bac ou équivalent 1987 Diplôme ou qualification obtenu(e). Lycée Clémenceau, Nantes - Domaine de formation : Mathématiques Voir plus Voir moins']","['Expérience Assistante Support Applicatif & Gestionnaire de données applicatives\n\n| UNILEVER FRANCE (RUEIL-MALMAISON) de mai 2019 à juil. 2020 (1 an et 3 mois) Gestionnaire et Administratrice de données de l’application Plan Promo Enseigne\nAssistante Supports Utilisateurs des outils informatiques (Plan Promo Enseigne, Data Impact, Super Assort Manager….)\nAssistante Support Utilisateurs des outils de reporting : Tableaux Croisés Dynamiques Excel\nSuivi et contrôle des flux de données quotidiens Compétences Analyser des données techniques pour optimiser les processus (Intermédiaire) Apporter une assistance technique aux équipes (Intermédiaire) Déterminer des mesures correctives (Intermédiaire) Système informatique (embarqué ou fixe) (Intermédiaire) Élaborer des solutions techniques et fonctionnelles (Avancé) Utilisation de logiciels de tableur (Avancé) Voir plus Voir moins', ""Expérience Développeuse en Informatique\n\n| BILLJOBS (75008 PARIS) de avr. 2018 à sept. 2018 (6 mois) Développement d'une application de gestion appelée Consolidation Client sous l'environnement XOJO Release 2007.3 et Postgres. Compétences Recueillir et analyser les besoins client (Débutant) Langages de programmation informatique (Intermédiaire) Système informatique (embarqué ou fixe) (Intermédiaire) Concevoir une application web (Avancé) Gestion de bases de données NoSQL (Avancé) Logiciel de traitement de texte (Avancé) Voir plus Voir moins"", ""Expérience Consultante en Maintenance applicative et Support Utilisateurs\n\n| EUROVL (Société Générale Securities Services)  + Ysance (La Défense + Paris) de juin 2010 à août 2013 (3 ans et 3 mois) - Assurer au sein du service MOE Applicative Web la maintenance applicative des applications développées avec les technologies  \n  Microsoft, et le support utilisateurs pour ces applications\n- Auto-Formation sur Qlikview + Excel au siège d'Ysance. Compétences Déterminer des mesures correctives (Intermédiaire) Langages de programmation informatique (Intermédiaire) Système informatique (embarqué ou fixe) (Intermédiaire) Visual Basic (Intermédiaire) Concevoir une application web (Avancé) Gestion de bases de données NoSQL (Avancé) Utilisation de logiciels de tableur (Avancé) Voir plus Voir moins"", 'Expérience Consultante / Développeur des interfaces ODI\n\n| AGEFOS PME de sept. 2009 à avr. 2010 (8 mois) Alimentation des entrepôts de données (datawarehouses) Editique, Infocentre avec Oracle Data Integrator (ODI). Compétences Concevoir une application web (Avancé) Gestion de bases de données NoSQL (Avancé) Voir plus Voir moins', 'Expérience Consultante pour la Maintenance Applicative + Support Utilisateurs de la Campagne d\'évaluation + Campagne de rémunération\n\n| CREDIT AGRICOLE ASSET MANAGEMENT (CAAM/AMUNDI) (Paris) de sept. 2008 à mars 2009 (7 mois) - Support Utilisateurs - Génération de fiches d\'entretiens - Import de résultats d\'entretiens vers la base statistique Access\n- Maintenance applicative et Support Utilisateurs de l\'application ""Campagne de rémunération"" en VBA Excel Compétences Déterminer des mesures correctives (Intermédiaire) Langages de programmation informatique (Intermédiaire) Système informatique (embarqué ou fixe) (Intermédiaire) Visual Basic (Intermédiaire) Concevoir une application web (Avancé) Logiciel de traitement de texte (Avancé) Utilisation de logiciels de tableur (Avancé) Voir plus Voir moins', ""Expérience Consultante en Informatique au département Administration-Valorisation\n\n| EUROVL (Société Générale Securities Services) de juin 2008 à sept. 2008 (4 mois) Maintenance applicative des outils de valorisation de fonds d'OPCVM  Support Utilisateurs Compétences Apporter une assistance technique aux équipes (Intermédiaire) Déterminer des mesures correctives (Intermédiaire) Langages de programmation informatique (Intermédiaire) Système informatique (embarqué ou fixe) (Intermédiaire) Visual Basic (Intermédiaire) Concevoir une application web (Avancé) Utilisation de logiciels de tableur (Avancé) Voir plus Voir moins"", ""Expérience Consultante pour la mise en place de la Campagne de rémunération\n\n| CREDIT AGRICOLE ASSET MANAGEMENT (CAAM/AMUNDI) de juil. 2007 à mars 2008 (9 mois) Dans le cadre de la Campagne de rémunération: mise en place de l'application de Saisie de propositions de la nouvelle rémunération. Compétences Déterminer des mesures correctives (Intermédiaire) Système informatique (embarqué ou fixe) (Intermédiaire) Visual Basic (Intermédiaire) Concevoir une application web (Avancé) Utilisation de logiciels de tableur (Avancé) Voir plus Voir moins"", 'Expérience Consultante pour l\'assistance à la Maîtrise d\'Ouvrage\n\n| Bnp Paribas de nov. 2006 à avr. 2007 (6 mois) Assurer la recette de données ""Suivi de Sollicitation Client"" sur le datamart ""Animation Commerciale Banque de détail"". Compétences Surveiller le fonctionnement d\'applicatifs et logiciels (Intermédiaire) Concevoir une application web (Avancé) Gestion de bases de données NoSQL (Avancé) Voir plus Voir moins', ""Expérience Suivi de projet\n\n| CAP GEMINI de août 1997 à avr. 1998 (9 mois) Suivi de projet pour la mise en place d'un logiciel de calcul de primes d'assurances de la société American Internation Assurance (AIA) - Recette/Tests Voir plus Voir moins"", ""Expérience Analyste-programmeur\n\n| L'Oréal Séoul (Corée du Sud) de nov. 1996 à juin 1997 (8 mois) Mise en place du nouveau système d'information pour l'administration des ventes des 2 nouvelles divisions L'Oréal Coiffure et L'Oréal Parfumerie Compétences Langages de programmation informatique (Intermédiaire) Système informatique (embarqué ou fixe) (Intermédiaire) Gestion de bases de données NoSQL (Avancé) Voir plus Voir moins"", 'Expérience Analyste-programmeur\n\n| MASTERLINE (SSII) de déc. 1992 à oct. 1996 (3 ans et 11 mois) Conception et développement de la plate-forme ""Administration des ventes, Logistiques et Comptabilité Client"" pour l\'Oréal Parfumerie et les Laboratoires Garnier Compétences Langages de programmation informatique (Intermédiaire) Système informatique (embarqué ou fixe) (Intermédiaire) Gestion de bases de données NoSQL (Avancé) Voir plus Voir moins']","['Algorithmique', 'C#', 'Gestion de bases de données NoSQL', 'HTML', 'Informatique', 'J2EE', 'Java', 'Langages de programmation informatique', 'Logiciel de traitement de texte', 'PHP', ""Système d'exploitation HP-Ux"", ""Système d'exploitation Unix"", ""Système d'exploitation Windows"", 'Système informatique (embarqué ou fixe)', 'Utilisation de logiciels de tableur', 'Visual Basic', 'Classer des documents', 'Maintenir une documentation précise et à jour', 'Réaliser une veille documentaire', 'Sélectionner des informations documentaires', 'Assister techniquement des collaborateurs', ""Renseigner les supports de suivi d'intervention"", ""Concevoir l'architecture d'un système, d'un réseau"", 'Concevoir une application web', 'Intégration de systèmes', 'Modélisation informatique', 'Déterminer des mesures correctives', ""Surveiller le fonctionnement d'applicatifs et logiciels"", 'Analyser, résoudre un problème courant ou complexe', 'Élaborer des solutions techniques et fonctionnelles', 'Apporter une assistance technique aux équipes', 'Recueillir et analyser les besoins client', 'Rédiger un cahier des charges, des spécifications techniques', 'Analyser des données techniques pour optimiser les processus']","[""Être à l'écoute, faire preuve d'empathie"", ""Faire preuve d'autonomie"", 'Faire preuve de persévérance', 'Organiser son travail selon les priorités et les objectifs', ""S'adapter aux changements"", 'Travailler en équipe']","['Anglais', 'Français- (Citoyenne française)', 'Vietnamien', 'Italien']",['B - Véhicule léger'],Administrateur de base de données
"['Formation Parcours Accès à la qualification Développeur Web et Web mobile 2024', 'Formation Titre professionnel Développeur Web et Web mobile 2024', 'Formation Licence Administration, économique et sociale\n\n| Bac+3, Bac+4 ou équivalents 2022 Diplôme ou qualification obtenu(e). - Domaine de formation : Écoute Sociale Voir plus Voir moins', 'Formation DUT techniques de Commercialisation\n\n| Bac+2 ou équivalents 2021 Diplôme ou qualification obtenu(e). - Domaine de formation : Technico-commercial Voir plus Voir moins', 'Formation Bac ES\n\n| Bac ou équivalent 2019 Diplôme ou qualification obtenu(e). - Domaine de formation : Économie Sociale Voir plus Voir moins']","[""Expérience Gestionnaire de planification\n\n| Carrefour de juil. 2023 à aujourd'hui (1 an et 9 mois)"", 'Expérience Vendeuse\n\n| Courir de févr. 2023 à mars 2023 (2 mois)', 'Expérience Opératrice de numérisation\n\n| Studia Solution de nov. 2022 à janv. 2023 (3 mois)', ""Expérience stage community manager\n\n| Daïymen Jeeliya janv. 2022 Amélioration et modification du site Internet\nCréation de logo\nAmélioration du feed Instagram \nOrganisation d'une vente privée\nPréparation de la nouvelle collection\nManager les réseaux sociaux Compétences Animer un réseau, une communauté Contrôler la réalisation de pages Web Réaliser des enquêtes et des sondages en ligne Réaliser la mise à jour d'un site web Réglementation des jeux et loteries Règles de diffusion et de communication de l'information Analyser des échanges communautaires en ligne (Avancé) Analyser le trafic d'un site web (Avancé) Identifier, traiter une demande client (Avancé) Voir plus Voir moins"", ""Expérience animatrice en centre aéré\n\n| Maison de quartier Billard (reims) de juin 2021 à août 2021 (3 mois) Encadrer les enfants dans les différents temps de la journée \nMise en place d'activité culinaire, artistique et dynamique\nGarantir la sécurité morale, physique et affective des enfants. Compétences Concevoir et animer des activités de détente ou de loisirs Expliquer et faire respecter les règles et procédures Informer les parents sur l'organisation de la structure et présenter le programme des activités aux enfants Observer le comportement, l'évolution de l'enfant et repérer d'éventuelles difficultés Réaliser des spectacles avec les enfants (élaboration du contenu, création de costumes, répétitions, ...) et les présenter au public Français (Courant) Voir plus Voir moins"", ""Expérience stage community manager\n\n| Dbags (evry) de avr. 2021 à juin 2021 (3 mois) Amélioration du feed Instagram \nAnimation du compte \nManager les différents réseaux sociaux\nCréation de contenu Compétences Appliquer les règles de diffusion de l'information et de la communication Approvisionnement en ligne / E achat Conception et analyse d'enquête Logiciels d'édition multimédia Marketing des réseaux sociaux Mettre en place des solutions de suivi (tracking) pour analyser le trafic d'un site et les comportements de navigation des visiteurs Mettre en place une solution de web Analytics (Débutant) Outils de web analyse - web analytics (Intermédiaire) Optimiser le référencement naturel (SEO) des sites web (Avancé) Français (Courant) Voir plus Voir moins"", ""Expérience Auxiliaire de vacances\n\n| Bnp Paribas (Reims) août 2020 Archivage de documents \nChargée d'accueil\nMise à jour des données bancaires\nAssistante banque privée Compétences Français (Courant) Anglais (Intermédiaire) Voir plus Voir moins"", ""Expérience vendeuse\n\n| C&A (Reims) de janv. 2020 à févr. 2020 (2 mois) Accueil client\nRéceptionniste les marchandises, les produits et contrôler la conformité de le livraison\nPréparer la mise en rayon des produits, des articles\nEffectuer le rangement et l'approvisionnement des rayons et de la réserve Compétences Argumentation commerciale Ranger des produits ou marchandises selon leurs dates de validité et les conditions de conservation Présenter et valoriser un produit ou un service (Intermédiaire) Techniques de vente et de promotion (Intermédiaire) Organiser, aménager un espace de vente (Avancé) Français (Courant) Voir plus Voir moins""]","['Approvisionnement en ligne / E achat', 'Argumentation commerciale', ""Conception et analyse d'enquête"", ""Logiciels d'édition multimédia"", 'Outils de web analyse - web analytics', 'Concevoir et animer des activités de détente ou de loisirs', 'Marketing des réseaux sociaux', 'Réglementation des jeux et loteries', ""Règles de diffusion et de communication de l'information"", 'Développer et fidéliser la relation client', 'Organiser, aménager un espace de vente', 'Présenter et valoriser un produit ou un service', 'Analyser des échanges communautaires en ligne', ""Appliquer les règles de diffusion de l'information et de la communication"", 'Expliquer et faire respecter les règles et procédures', ""Mettre en place des solutions de suivi (tracking) pour analyser le trafic d'un site et les comportements de navigation des visiteurs"", 'Réaliser des enquêtes et des sondages en ligne', 'Identifier, traiter une demande client', ""Informer les parents sur l'organisation de la structure et présenter le programme des activités aux enfants"", 'Mettre en place une solution de web Analytics', 'Optimiser le référencement naturel (SEO) des sites web', 'Techniques de vente et de promotion', 'Techniques de vente par téléphone', ""Réaliser la mise à jour d'un site web"", 'Réaliser des spectacles avec les enfants (élaboration du contenu, création de costumes, répétitions, ...) et les présenter au public', ""Analyser le trafic d'un site web"", 'Ranger des produits ou marchandises selon leurs dates de validité et les conditions de conservation', 'Animer un réseau, une communauté', 'Contrôler la réalisation de pages Web', ""Observer le comportement, l'évolution de l'enfant et repérer d'éventuelles difficultés""]","['Faire preuve de persévérance', 'Gérer son stress', 'Organiser son travail selon les priorités et les objectifs', ""S'adapter aux changements""]","['Français', 'Anglais', 'Allemand', 'Arabe']",['B - Véhicule léger'],Administrateur de base de données
"[""Formation Techniques bancaires \n\n| Bac+2 ou équivalents 2013 Diplôme ou qualification obtenu(e). - Domaine de formation : Banque - Formation effectuée à l'étranger Voir plus Voir moins""]","[""Expérience Controleur de gestion\n\n| carrefour (Algérie) de nov. 2016 à juin 2022 (5 ans et 8 mois) Analyse et suivi de la performance commerciale : élaboration des indicateurs de suivi de l’activité (reporting, tableaux de bord et suivi de la concurrence), suivi des objectifs prévisionnels, pricing et optimisation de la marge, calcul et suivi de la marge arrière, analyse et contrôle des résultats d’inventaires, suivi des stocks et calcul de la décote, analyse et suivi de la base de données. Compétences Contrôler la qualité d'une base de données Corriger les écarts de stock Voir plus Voir moins"", 'Expérience Financier\n\n| carrefour (Algérie) de avr. 2015 à oct. 2016 (1 an et 7 mois) • Traitement des litiges fournisseurs (commandes, facturation).\n• Suivi des stocks marchandises.\n• Suivi catalogue (promotion et approvisionnement).\n• Rapprochement des factures et des commandes fournisseur. Voir plus Voir moins', ""Expérience Apprenti financier \n\n| Banque centrale d'Algérie (Algérie) de nov. 2010 à mai 2013 (2 ans et 7 mois) Direction des services bancaires étrangers, participation:\n• Au suivi de la dette extérieur Algérienne.\n• Au remboursement des échéances.\nDirection de la comptabilité, participation:\n• A l’encaissement des produits issus de la vente des bons du trésor.\n• A l’enregistrement des recettes au compte courant du trésor public.\n• Au suivi du remboursement des échéances. Voir plus Voir moins""]","[""Contrôler la qualité d'une base de données"", ""Calculer les marges, la rentabilité d'un produit ou d'une activité"", 'Gestion du Back Office', 'Corriger les écarts de stock', ""Indicateurs de suivi d'activité"", 'Déterminer des mesures correctives', 'gestionnaire de base de données']","[""Faire preuve d'autonomie"", ""Faire preuve de créativité, d'inventivité"", 'Faire preuve de rigueur et de précision', ""S'adapter aux changements"", 'Travailler en équipe']","['Arabe', 'Français', 'Anglais']",['B - Véhicule léger'],Administrateur de base de données
"['Formation Bac Pro bureautique\n\n| Bac ou équivalent 1992 - Domaine de formation : Bureautique Voir plus Voir moins', 'Formation Administration commerciale et comptable\n\n| CAP, BEP et équivalents 1990 Diplôme ou qualification obtenu(e). - Domaine de formation : Administration Ventes Voir plus Voir moins']","['Expérience Coordinateur ordonnancement\n\n| HORIBA (Longjumeau) de juin 2020 à nov. 2021 (1 an et 6 mois) Gestion, analyses et suivi des besoins pour la Production Voir plus Voir moins']","['Anglais technique', 'Comptabilité bancaire', 'Comptabilité client', 'Comptabilité fournisseurs', 'Gestion administrative', 'Logiciel de gestion clients', 'Logiciel de traitement de texte', 'Utilisation de logiciels de tableur', 'Codifier une facture', 'Effectuer le suivi des commandes, la facturation', ""Informer le client sur les conditions de réalisation d'une commande"", ""Vérifier les conditions de réalisation d'une commande"", 'Assurer un service après-vente', 'Développer et fidéliser la relation client', 'Établir un devis', 'Corriger et mettre en forme un document', 'Numériser des documents, médias ou supports techniques', 'Utiliser les outils numériques', 'Indexer des dossiers et documents de référence', 'Mettre à jour un dossier, une base de données', 'Gérer les stocks', 'Organiser et contrôler un approvisionnement', ""Enregistrer les recettes d'une entreprise"", 'Réaliser des opérations comptables', 'Données de contrôle', ""Méthode de classement et d'archivage"", ""Contrôler la constitution d'une préparation"", ""Contrôler la saisie d'informations"", ""Relayer de l'information"", 'Conseiller, accompagner une personne', 'Assurer un accueil téléphonique', 'Piloter une activité', 'Techniques de numérisation']","[""Être à l'écoute, faire preuve d'empathie"", ""Faire preuve d'autonomie"", 'Faire preuve de curiosité', 'Faire preuve de persévérance', 'Faire preuve de réactivité', 'Faire preuve de rigueur et de précision', ""S'adapter aux changements"", 'Travailler en équipe']",['Anglais'],['B - Véhicule léger'],Administrateur de base de données
"[""Formation Master en Ingénierie Logicielle et Management des Systèmes d'Information\n\n| Bac+5 et plus ou équivalents Cette Formation contient une pièce jointe 2024 Diplôme ou qualification obtenu(e). Pièces jointes .pdf Voir plus Voir moins"", ""Formation BTS SIO(Services Informatiques aux Organisations) SLAM(Solutions Logicielles et Application Métiers)\n\n| Bac+2 ou équivalents Cette Formation contient une pièce jointe 2021 Diplôme ou qualification obtenu(e). - Domaine de formation : Informatique Et Systèmes D'information Pièces jointes .pdf Voir plus Voir moins"", ""Formation Bac S SI (Science de l'Ingénierie)\n\n| Bac ou équivalent 2019 Diplôme ou qualification obtenu(e). - Domaine de formation : Informatique Et Systèmes D'information Voir plus Voir moins""]","['Expérience Apprentie chef de projet informatique\n\n| Ticketmaster (Nanterre préfecture) de sept. 2022 à déc. 2022 (4 mois) Développement métier back-office en C Voir plus Voir moins', ""Expérience Développeuse JAVA/Angular\n\n| Covéa GMF (Ermont) de sept. 2022 à août 2024 (1 an et 11 mois) Refont du front d'une application interne en Angular Refont du back d'une application interne en Java Voir plus Voir moins"", ""Expérience Ingenieur R&D\n\n| Caisse d'Assurance Vieillesse des Pharmaciens (CAVP) (Paris 9ème) de nov. 2020 à déc. 2020 (2 mois) Réalisation de tableaux de statistiques pour un service dans l'entreprise. Outils et langage utilisés : RazorSql, Eclipse, JBoss, subversion, Jenkins, Java, PrimeFaces Voir plus Voir moins""]","['Travailler en groupe, en réseau', 'Rédiger un cahier des charges, des spécifications techniques', 'Concevoir une application web', 'Application web', 'Déterminer des mesures correctives', 'Recueillir et analyser les besoins client']","[""Faire preuve d'autonomie"", 'Organiser son travail selon les priorités et les objectifs', 'Travailler en équipe']","['Français', 'Anglais']",['B - Véhicule léger'],Administrateur de base de données
